{
	"classes": {
		"death_knight": "Chevalier de la mort",
		"druid": "Druide",
		"hunter": "Chasseur",
		"mage": "Mage",
		"monk": "Moine",
		"paladin": "Paladin",
		"priest": "Prêtre",
		"rogue": "Voleur",
		"shaman": "Chaman",
		"warlock": "Démoniste",
		"warrior": "Guerrier"
	},
	"specs": {
		"death_knight": {
			"blood": "Sang",
			"frost": "Givre",
			"unholy": "Impie"
		},
		"druid": {
			"balance": "Équilibre",
			"feral": "Farouche",
			"guardian": "Gardien",
			"restoration": "Restauration"
		},
		"hunter": {
			"beast_mastery": "Maîtrise des bêtes",
			"marksmanship": "Précision",
			"survival": "Survie"
		},
		"mage": {
			"arcane": "Arcane",
			"fire": "Feu",
			"frost": "Givre"
		},
		"monk": {
			"brewmaster": "Maître brasseur",
			"mistweaver": "Tisse-brume",
			"windwalker": "Marche-vent"
		},
		"paladin": {
			"holy": "Sacré",
			"protection": "Protection",
			"retribution": "Vindicte"
		},
		"priest": {
			"discipline": "Discipline",
			"holy": "Sacré",
			"shadow": "Ombre"
		},
		"rogue": {
			"assassination": "Assassinat",
			"combat": "Combat",
			"subtlety": "Finesse"
		},
		"shaman": {
			"elemental": "Élémentaire",
			"enhancement": "Amélioration",
			"restoration": "Restauration"
		},
		"warlock": {
			"affliction": "Affliction",
			"demonology": "Démonologie",
			"destruction": "Destruction"
		},
		"warrior": {
			"arms": "Armes",
			"fury": "Fureur",
			"protection": "Protection"
		}
	},
	"races": {
		"unknown": "Aucun",
		"blood_elf": "Elfe de sang",
		"draenei": "Draenei",
		"dwarf": "Nain",
		"gnome": "Gnome",
		"goblin": "Gobelin",
		"human": "Humain",
		"night_elf": "Elfe de la nuit",
		"orc": "Orc",
		"alliance_pandaren": "Pandaren (A)",
		"horde_pandaren": "Pandaren (H)",
		"tauren": "Tauren",
		"troll": "Troll",
		"undead": "Mort-vivant",
		"worgen": "Worgen"
	},
	"professions": {
		"unknown": "Aucun",
		"alchemy": "Alchimie",
		"blacksmithing": "Forge",
		"enchanting": "Enchantement",
		"engineering": "Ingénierie",
		"herbalism": "Herboristerie",
		"inscription": "Calligraphie",
		"jewelcrafting": "Joaillerie",
		"leatherworking": "Travail du cuir",
		"mining": "Minage",
		"skinning": "Dépeçage",
		"tailoring": "Couture",
		"archeology": "Archéologie"
	}
}
